{
  "$schema": "https://json-schema.org/draft/2020-12/schema",
  "title": "connections library item",
  "type": "object",
  "required": [
    "category",
    "domain",
    "id",
    "locales",
    "name",
    "version"
  ],
  "properties": {
    "category": {
      "type": "string"
    },
    "domain": {
      "type": "string"
    },
    "id": {
      "type": "string"
    },
    "locales": {
      "type": "object"
    },
    "name": {
      "type": "string"
    },
    "source": {
      "type": "string"
    },
    "version": {
      "type": "integer"
    }
  },
  "additionalProperties": true
}
